{"bom":[{"asset_ids":["0777b876264a4839d1e9b3553b38cb8c84b9170ac11346c3e86d3304320a6125","086e50644730b60d47a79a1e30ab1cae1b8a7990949d211f5519c196040f3a2b","117f4de7a1548e497af4e993cb007d6b68054ee10a6272819da76cc33133c5df","155e0b9fcf3414d2e3b90fcbf05b44602666748de2c4726f2a1a5deed700c39f","215dee03285220a477d9f0a6fb364f77d6e392d35c012103bcf0955db786af6a","216140d5a320efb3835ef84f3210ade618f41377e69cedbc81773f5c6fa19868","2499a5d87947540970f7e60559e32c83ddf9e63d30b08b3b8a55f16250161b62","2ae7f1c00b91c9cdb61c2a193626c7df3ddf8ecee522545f834c11521e136522","2e70a604b27f81122ca067a4fe64714b4313c54326bf493c2ca6e9071953f2c8","336cc4fbf19beaada7ccf9986414fa91851a8d7a07dfb3ccbe800a69eed0ab49","33c6d019f2e9dfd2c0f257029fd2962a84619392d99e480adc860bb8e2db0ee1","3733399c57b73d3776aa657958078b54b5300ba819ab65c1cc3ea568304193ed","42b0f61a00fe9d0595225acc0cc98343490557ecf14cdf971fedf49be778e7c7","4480a1ec79ac9fc5141d8e642d834670e2e4474051b11021a170f6d924a53430","46fde15c419eff5a743cf24c63952769fa91eedfcb2dffeef027e3397283a24a","4934f35bc17635d5c13d7cec9d2492726e4c238cacdff95218862a2df6425bbd","5276c09dc9e08e33f592f0b1584bee565c93ce0b6cf7f8be76cf94d85e5c2313","536d98c31b2f426d5291970d51c13778531ac80fa87ccc896c2f55692644db1b","5daa9bb5314a56aceebc117677377d8f558000d2907ef2acfaec1ff06c6e3635","5e6c487b163a1fe6dd875f4989ff2c3077ff89d749a4164aac6a6bc968cf170f","6495ed93579c91bace7cc0e9049f64db50a204b75abe6cd5212ad3f6d90bfe45","7156394a1d6691e064bd5eb3198a8cac044516389286e142411589a35d0799f6","7b6c993a86afcc48b4689cd76bf7dd67bb132b68afec7f2cc28e44168d145563","7e1bed5727455825e6ae5a7b70cdde52839aae2fb694916d476929fb6859baa4","7ebb32d045864bc66c92b28463d840a2a4e462e3964cd07dc49215d07e839a2f","8c7fe065afded74dcd79f054af7d37823030b88c1e2f399e338454f5f78f8a12","8eeb84dd3cf98cba46a1c65c6484de8a704d9bdcb35ca80e9794e1f98ffed662","924d87c7c5bdfd63a5962e131345586578871f4ad676fd210abbd69bd977eb3b","960a1b02ca1eb19c07e85ff62602621d7b6c71b01cabe13ae38da35dab0b6c73","99ebb4f7c9967ceee54543647823b257a9fa049276c99c539810097086665925","9a4394943044a107c0ff2f1aec39dc5aad48d44efaf6c3b4f429b3b1a0674e9a","9b94280b974e2de7bc7574519d486929e995a32f111f84f7745836b9061b0366","a6883fe14b28b13b1e2f64d56e4d6713d9951a14f9b39c4da4cb25d747dd2362","aa6b7ef31a053436d8a5e0f6917721ee448c15f5fa37ba759fe4f386c30a1fa9","ab062b8220c3944a959d7b5cee80f90a1152b70936ced14f7b1920e27c2ff8b2","b01d69e92c49bda1964fa2506746a54280156b4674c2904dd6ea8b095e204910","b0dcb74a925f3a7659851be21605896bf43754a13777a5533e2c31a9dee7dcb7","b17e8ef23fb8568661a6da91baa3d37cc86e61ab89f6e806df9456b14497c84e","b24b1497d4e7520f49dde14b139ac3b4b1dc21469794dc2b828a7003efa527c6","b83f1629a3a181da450a7b9183207582cd8da84543ba200005646627cc02d9d5","ba233fa56416821d318fead2e5efa3c4fba4f6e3e60fa63cbc46b751fdfdb5b7","bd486fa72560403a7f9a4364b6041076dada5ca4cc7628060ce87f801618ff65","bf4973fadf1ae66965ad7b6310f1af2f4c6bfb503d9d3971d80f3ec7b2a43af4","c0668bd32a81a5d1eb9471555ddd00691a9660585a5810e3a84482b18bd9d251","c262c0df590d8135a1467280ae6d572434b5888898026842ea6bd1a8edb03388","c329782bc872719a2646627e8aea6f89ca370f30eaa02bfbc97eac2823c3a5ba","c69134004dc34d6159a8c1d459aceb4aa6e693ee549d5e303cd928a1f8188442","cba2c9f16b6c43822e3a9a4dcb242003918263804e75c8ce54fe9292aa97e121","cc335fe3b1d845a042f7508e7010a3d6b118a563949ff35a790b63b5df1ead65","dc38b0ba56d5c22732ab759ea7ded3f93645c75ec86606fe00661ad3b0acf8b1","de65180ec043a42c83e2d62354d69bfd3a6bbd109ec649e8b23e9712bd1a5a0e","e02c275021218577b8d22feb84cff41c6fe9188de5d9ab1152bfa08b4913d5bc","e0b48dd6af29715c50a52d4e37deac3ce251bef5cca8bc58e7607b805e05cec1","e5bbb3b34456fb09c199306cd3ef07909386a56a7ca19b35a6cad14e2f50d432","e86800614a65ff8177e8bd49b295ce9a9afb1a83bdb5f566dc17cefa60ae8ff7","ec400c5acc2b1df8afd070b1748daf7f2b9a1fcfb3c689c86ab61a3cbc9b9b37","eed20eef567a7307a87c45ac041d524a4ccf028bf254f008ec1c5eb61c7e4ece","f75f5165861cb3a5bfaee91c2ecdd7223f93fb0a989fc7bf9c2f0f712d08532d"],"bom_version":"37a8966195db853db85650f6b277dd0aa856803584c23839b2c76c5620bcfbaa"}],"coverage":{"bytes_read":13188584,"cursor_state":"fresh","lines_seen":2635,"lines_unknown_type":383,"run_id_basis":"test_secret","sessions_emitted":1,"sessions_seen":1,"sessions_skipped_unparseable":0,"truncated_sessions":1,"window_days":30},"emitted_day":"2026-09-02","envelope_version":"0.1.0","extractor_version":"proto-0.1.0+taskcat-1","gate_version":1,"records":[{"assets":[{"asset_id":"0777b876264a4839d1e9b3553b38cb8c84b9170ac11346c3e86d3304320a6125","asset_type":"skill","binding":"unproven","direct_evidence_available":false,"key_basis":"content_hash","signals":{"context_cost_est":{"method":"listing_bytes_div4","tokens":111},"failures":{"interrupted":0,"timeout":0,"tool_error":0,"unknown":0,"user_denied":0},"harness_corroborations":null,"invocations":{"n":0},"latency_ms":{"max":0,"min":0,"n":0,"sum":0,"sumsq":0},"tokens_attributed":null},"tier":"inferred"},{"asset_id":"086e50644730b60d47a79a1e30ab1cae1b8a7990949d211f5519c196040f3a2b","asset_type":"skill","binding":"unproven","direct_evidence_available":false,"key_basis":"content_hash","signals":{"context_cost_est":{"method":"listing_bytes_div4","tokens":242},"failures":{"interrupted":0,"timeout":0,"tool_error":0,"unknown":0,"user_denied":0},"harness_corroborations":null,"invocations":{"n":0},"latency_ms":{"max":0,"min":0,"n":0,"sum":0,"sumsq":0},"tokens_attributed":null},"tier":"inferred"},{"asset_id":"117f4de7a1548e497af4e993cb007d6b68054ee10a6272819da76cc33133c5df","asset_type":"skill","binding":"not_applicable","direct_evidence_available":false,"key_basis":"name_hash","signals":{"context_cost_est":{"method":"listing_bytes_div4","tokens":92},"failures":{"interrupted":0,"timeout":0,"tool_error":0,"unknown":0,"user_denied":0},"harness_corroborations":null,"invocations":{"n":0},"latency_ms":{"max":0,"min":0,"n":0,"sum":0,"sumsq":0},"tokens_attributed":null},"tier":"inferred"},{"asset_id":"155e0b9fcf3414d2e3b90fcbf05b44602666748de2c4726f2a1a5deed700c39f","asset_type":"skill","binding":"unproven","direct_evidence_available":false,"key_basis":"content_hash","signals":{"context_cost_est":{"method":"listing_bytes_div4","tokens":76},"failures":{"interrupted":0,"timeout":0,"tool_error":0,"unknown":0,"user_denied":0},"harness_corroborations":null,"invocations":{"n":0},"latency_ms":{"max":0,"min":0,"n":0,"sum":0,"sumsq":0},"tokens_attributed":null},"tier":"inferred"},{"asset_id":"215dee03285220a477d9f0a6fb364f77d6e392d35c012103bcf0955db786af6a","asset_type":"skill","binding":"unproven","direct_evidence_available":false,"key_basis":"content_hash","signals":{"context_cost_est":{"method":"listing_bytes_div4","tokens":84},"failures":{"interrupted":0,"timeout":0,"tool_error":0,"unknown":0,"user_denied":0},"harness_corroborations":null,"invocations":{"n":0},"latency_ms":{"max":0,"min":0,"n":0,"sum":0,"sumsq":0},"tokens_attributed":null},"tier":"inferred"},{"asset_id":"216140d5a320efb3835ef84f3210ade618f41377e69cedbc81773f5c6fa19868","asset_type":"skill","binding":"unproven","direct_evidence_available":false,"key_basis":"content_hash","signals":{"context_cost_est":{"method":"listing_bytes_div4","tokens":122},"failures":{"interrupted":0,"timeout":0,"tool_error":0,"unknown":0,"user_denied":0},"harness_corroborations":null,"invocations":{"n":0},"latency_ms":{"max":0,"min":0,"n":0,"sum":0,"sumsq":0},"tokens_attributed":null},"tier":"inferred"},{"asset_id":"2499a5d87947540970f7e60559e32c83ddf9e63d30b08b3b8a55f16250161b62","asset_type":"skill","binding":"unproven","direct_evidence_available":false,"key_basis":"content_hash","signals":{"context_cost_est":{"method":"listing_bytes_div4","tokens":244},"failures":{"interrupted":0,"timeout":0,"tool_error":0,"unknown":0,"user_denied":0},"harness_corroborations":null,"invocations":{"n":0},"latency_ms":{"max":0,"min":0,"n":0,"sum":0,"sumsq":0},"tokens_attributed":null},"tier":"inferred"},{"asset_id":"2ae7f1c00b91c9cdb61c2a193626c7df3ddf8ecee522545f834c11521e136522","asset_type":"skill","binding":"not_applicable","direct_evidence_available":false,"key_basis":"name_hash","signals":{"context_cost_est":{"method":"listing_bytes_div4","tokens":49},"failures":{"interrupted":0,"timeout":0,"tool_error":0,"unknown":0,"user_denied":0},"harness_corroborations":null,"invocations":{"n":0},"latency_ms":{"max":0,"min":0,"n":0,"sum":0,"sumsq":0},"tokens_attributed":null},"tier":"inferred"},{"asset_id":"2e70a604b27f81122ca067a4fe64714b4313c54326bf493c2ca6e9071953f2c8","asset_type":"skill","binding":"not_applicable","direct_evidence_available":false,"key_basis":"name_hash","signals":{"context_cost_est":{"method":"listing_bytes_div4","tokens":361},"failures":{"interrupted":0,"timeout":0,"tool_error":0,"unknown":0,"user_denied":0},"harness_corroborations":null,"invocations":{"n":0},"latency_ms":{"max":0,"min":0,"n":0,"sum":0,"sumsq":0},"tokens_attributed":null},"tier":"inferred"},{"asset_id":"336cc4fbf19beaada7ccf9986414fa91851a8d7a07dfb3ccbe800a69eed0ab49","asset_type":"rules_file","binding":"harness_log_exact","direct_evidence_available":false,"key_basis":"content_hash","signals":{"context_cost_est":{"method":"file_bytes_div4","tokens":2},"failures":{"interrupted":0,"timeout":0,"tool_error":0,"unknown":0,"user_denied":0},"harness_corroborations":null,"invocations":{"n":0},"latency_ms":{"max":0,"min":0,"n":0,"sum":0,"sumsq":0},"tokens_attributed":null},"tier":"inferred"},{"asset_id":"33c6d019f2e9dfd2c0f257029fd2962a84619392d99e480adc860bb8e2db0ee1","asset_type":"skill","binding":"not_applicable","direct_evidence_available":false,"key_basis":"name_hash","signals":{"context_cost_est":{"method":"listing_bytes_div4","tokens":16},"failures":{"interrupted":0,"timeout":0,"tool_error":0,"unknown":0,"user_denied":0},"harness_corroborations":null,"invocations":{"n":0},"latency_ms":{"max":0,"min":0,"n":0,"sum":0,"sumsq":0},"tokens_attributed":null},"tier":"inferred"},{"asset_id":"3733399c57b73d3776aa657958078b54b5300ba819ab65c1cc3ea568304193ed","asset_type":"mcp_server","binding":"not_applicable","direct_evidence_available":true,"key_basis":"name_hash","